{
  "schema_version": "wf.ai.command-envelope.v1",
  "catalog_version": "wf.ai.skill-catalog.v1",
  "skill_id": "inventory",
  "skill_version": "1.0.0",
  "envelope_id": "env_test_inventory_001",
  "idempotency_key": "test-inventory-001",
  "status": "commands",
  "evidence": [
    {
      "evidence_id": "ev_test_user_1",
      "type": "user_text",
      "source_ref": "turn:test:local",
      "quote": "I bought a dozen eggs and two bags frozen berries.",
      "observed_at": "2026-01-15T12:00:00Z",
      "confidence": 1.0
    }
  ],
  "commands": [
    {
      "command_id": "cmd_1",
      "type": "inventory.add_lot",
      "summary": "Add 12 eggs to fridge inventory.",
      "payload": {
        "name": "Eggs",
        "quantity": {
          "amount": 12,
          "unit": "count",
          "text": "a dozen"
        },
        "storage_zone": "FRIDGE",
        "category": "protein",
        "source": "user_text"
      },
      "evidence_refs": [
        "ev_test_user_1"
      ],
      "confidence": {
        "score": 0.94,
        "rationale": "Item, quantity, and likely storage zone are explicit."
      },
      "confirmation": {
        "required": false,
        "level": "review",
        "reason": "Normal inventory addition still receives proposal review.",
        "prompt": "Add eggs to the fridge?"
      },
      "destructive": false,
      "mutation": true
    },
    {
      "command_id": "cmd_2",
      "type": "inventory.add_lot",
      "summary": "Add two bags of frozen berries to freezer inventory.",
      "payload": {
        "name": "Frozen Berries",
        "quantity": {
          "amount": 2,
          "unit": "bag",
          "text": "two bags"
        },
        "storage_zone": "FREEZER",
        "category": "fruit",
        "source": "user_text"
      },
      "evidence_refs": [
        "ev_test_user_1"
      ],
      "confidence": {
        "score": 0.96,
        "rationale": "Frozen implies freezer and quantity is explicit."
      },
      "confirmation": {
        "required": false,
        "level": "review",
        "reason": "Normal inventory addition still receives proposal review.",
        "prompt": "Add frozen berries to the freezer?"
      },
      "destructive": false,
      "mutation": true
    }
  ],
  "confidence": {
    "score": 0.95,
    "rationale": "Clear acquisition language with two generic food items."
  },
  "confirmation": {
    "required": false,
    "level": "review",
    "reason": "Non-destructive additions still need proposal review.",
    "prompt": "Review and add these inventory lots?"
  },
  "warnings": [],
  "unsupported": null
}
