{
  "schema_version": "wf.ai.command-envelope.v1",
  "catalog_version": "wf.ai.skill-catalog.v1",
  "skill_id": "planning",
  "skill_version": "1.0.0",
  "envelope_id": "env_planning_001",
  "idempotency_key": "turn-local-planning-001",
  "status": "commands",
  "evidence": [
    {
      "evidence_id": "ev_user_1",
      "type": "user_text",
      "source_ref": "turn:user:local",
      "quote": "Plan three dinners using spinach, rice, and eggs.",
      "observed_at": null,
      "confidence": 1.0
    },
    {
      "evidence_id": "ev_inventory_1",
      "type": "inventory_snapshot",
      "source_ref": "inventory:snapshot:local",
      "quote": "Spinach, rice, eggs available",
      "observed_at": null,
      "confidence": 0.9
    }
  ],
  "commands": [
    {
      "command_id": "cmd_1",
      "type": "planning.create_meal_plan",
      "summary": "Create a three-dinner plan from available foods.",
      "payload": {
        "title": "Three Pantry Dinners",
        "start_on": "next_available_day",
        "entries": [
          {
            "day_offset": 0,
            "meal_slot": "DINNER",
            "title": "Spinach Egg Rice Bowl",
            "recipe_ref": null
          },
          {
            "day_offset": 1,
            "meal_slot": "DINNER",
            "title": "Fried Rice With Egg",
            "recipe_ref": null
          },
          {
            "day_offset": 2,
            "meal_slot": "DINNER",
            "title": "Spinach Rice Soup",
            "recipe_ref": null
          }
        ],
        "shopping_suggestions": [],
        "constraints_used": [
          "Use spinach",
          "Use rice",
          "Use eggs"
        ]
      },
      "evidence_refs": [
        "ev_user_1",
        "ev_inventory_1"
      ],
      "confidence": {
        "score": 0.84,
        "rationale": "Meal count and key ingredients are explicit."
      },
      "confirmation": {
        "required": false,
        "level": "review",
        "reason": "Non-destructive plan creation.",
        "prompt": "Save this meal plan?"
      },
      "destructive": false,
      "mutation": true
    }
  ],
  "confidence": {
    "score": 0.84,
    "rationale": "User asked for a plan and named constraints."
  },
  "confirmation": {
    "required": false,
    "level": "review",
    "reason": "Plan creation is non-destructive.",
    "prompt": "Review and save this plan?"
  },
  "warnings": [],
  "unsupported": null
}
