{
  "schema_version": "wf.ai.command-envelope.v1",
  "catalog_version": "wf.ai.skill-catalog.v1",
  "skill_id": "planning",
  "skill_version": "1.0.0",
  "envelope_id": "env_test_meal_plan_001",
  "idempotency_key": "test-meal-plan-001",
  "status": "commands",
  "evidence": [
    {
      "evidence_id": "ev_user_plan_1",
      "type": "user_text",
      "source_ref": "turn:test:local",
      "quote": "Plan lunch for tofu bowl tomorrow.",
      "observed_at": null,
      "confidence": 1.0
    }
  ],
  "commands": [
    {
      "command_id": "cmd_plan_1",
      "type": "planning.create_meal_plan",
      "summary": "Create one-day plan for tofu bowl.",
      "payload": {
        "title": "Tomorrow tofu dinner plan",
        "entries": [
          {
            "day_offset": 1,
            "meal_slot": "LUNCH",
            "title": "Tofu Bowl",
            "calorie_target": 520
          }
        ],
        "shopping_suggestions": ["tofu", "coconut milk", "spinach"]
      },
      "evidence_refs": [
        "ev_user_plan_1"
      ],
      "confidence": {
        "score": 0.9,
        "rationale": "Plan slot and title are explicit."
      },
      "confirmation": {
        "required": false,
        "level": "review",
        "reason": "Meal plan is reviewable.",
        "prompt": "Save this meal plan?"
      },
      "destructive": false,
      "mutation": true
    }
  ],
  "confidence": {
    "score": 0.92,
    "rationale": "Single planned meal has explicit slot and entry title."
  },
  "confirmation": {
    "required": false,
    "level": "review",
    "reason": "Plan creation is reviewable.",
    "prompt": "Review planned meal list?"
  },
  "warnings": [],
  "unsupported": null
}
