{
  "schema_version": "wf.ai.command-envelope.v1",
  "catalog_version": "wf.ai.skill-catalog.v1",
  "skill_id": "receipt_parsing",
  "skill_version": "1.0.0",
  "envelope_id": "env_receipt_001",
  "idempotency_key": "receipt-local-001",
  "status": "needs_confirmation",
  "evidence": [
    {
      "evidence_id": "ev_receipt_1",
      "type": "receipt_text",
      "source_ref": "receipt:pending:local",
      "quote": "EGGS 3.99 SPINACH 2.49 RICE 5.99",
      "observed_at": null,
      "confidence": 0.82
    }
  ],
  "commands": [
    {
      "command_id": "cmd_1",
      "type": "receipt.attach_parse",
      "summary": "Attach parsed receipt lines.",
      "payload": {
        "receipt_ref": "receipt:pending:local",
        "merchant": null,
        "purchased_at": null,
        "raw_text": "EGGS 3.99\nSPINACH 2.49\nRICE 5.99",
        "line_items": [
          {
            "description": "Eggs",
            "quantity": null,
            "price": 3.99,
            "confidence": 0.86
          },
          {
            "description": "Spinach",
            "quantity": null,
            "price": 2.49,
            "confidence": 0.84
          },
          {
            "description": "Rice",
            "quantity": null,
            "price": 5.99,
            "confidence": 0.81
          }
        ],
        "subtotal": null,
        "tax": null,
        "total": null,
        "parser": {
          "catalog_version": "wf.ai.skill-catalog.v1",
          "source": "ai_receipt_parse"
        }
      },
      "evidence_refs": [
        "ev_receipt_1"
      ],
      "confidence": {
        "score": 0.82,
        "rationale": "Food lines are readable; quantities are missing."
      },
      "confirmation": {
        "required": false,
        "level": "review",
        "reason": "Attaching parse keeps failed/uncertain lines reviewable.",
        "prompt": "Attach this receipt parse?"
      },
      "destructive": false,
      "mutation": true
    },
    {
      "command_id": "cmd_2",
      "type": "receipt.propose_items",
      "summary": "Propose receipt foods for inventory review.",
      "payload": {
        "receipt_ref": "receipt:pending:local",
        "destination": "inventory",
        "reason": "Receipt indicates purchased foods.",
        "items": [
          {
            "name": "Eggs",
            "quantity": null,
            "storage_zone": "FRIDGE",
            "line_ref": "cmd_1.line_items[0]"
          },
          {
            "name": "Spinach",
            "quantity": null,
            "storage_zone": "FRIDGE",
            "line_ref": "cmd_1.line_items[1]"
          },
          {
            "name": "Rice",
            "quantity": null,
            "storage_zone": "PANTRY",
            "line_ref": "cmd_1.line_items[2]"
          }
        ]
      },
      "evidence_refs": [
        "ev_receipt_1"
      ],
      "confidence": {
        "score": 0.78,
        "rationale": "Item names are clear but quantities are absent."
      },
      "confirmation": {
        "required": true,
        "level": "confirm",
        "reason": "Receipt items need user review before inventory mutation.",
        "prompt": "Review receipt items before adding them to inventory."
      },
      "destructive": false,
      "mutation": true
    }
  ],
  "confidence": {
    "score": 0.8,
    "rationale": "Receipt lines are readable with missing quantities."
  },
  "confirmation": {
    "required": true,
    "level": "confirm",
    "reason": "Parsed receipt items must be confirmed before product data changes.",
    "prompt": "Review parsed receipt items?"
  },
  "warnings": [
    {
      "code": "ambiguous_quantity",
      "severity": "review",
      "message": "Receipt lines do not include package counts.",
      "evidence_refs": [
        "ev_receipt_1"
      ]
    }
  ],
  "unsupported": null
}
